newsId,title,summary,link
6087759,〈能源盤後〉OPEC+恐增產 7 月非農數據遠遜預期 引發需求擔憂 原油跌2美元,由於 OPEC + 可能增產，以及弱於預期的美國就業報告加劇對需求的擔憂，原油期貨價格周五 (1 日) 大跌 2 美元 / 桶。,https://m.cnyes.com/news/id/6087759
6087627,〈紐約匯市〉 美元重挫 今年降息預期升高,美元周五 (1 日) 下跌，兌日元單日跌幅為 2023 年 1 月以來最大。此前公布數據顯示，美國 7 月新增就業人數遠低於經濟學家預期，而 6 月的就業增幅也被大幅下修，促使市場對聯準會 (Fed) 今年降息次數的預期迅速升高。,https://m.cnyes.com/news/id/6087627
6087821,〈美股盤後〉美非農就業爆冷 道瓊五連跌創今年以來最長 亞馬遜市值蒸發逾2000億美元,就業數據令人失望與關稅衝擊，美股週五 (1 日) 大幅走低，恐慌指數 VIX 躍升至近六週高點，道瓊收黑 542 點，一度狂瀉 790 點，該指數連續第五天下跌，創下今年最長的連跌紀錄。,https://m.cnyes.com/news/id/6087821
6087723,美貿易代表：關稅遭法院推翻也不怕 會持續與各國進行貿易談判,根據《彭博》周五 (1 日) 報導，美國貿易代表 Jamieson Greer 稱，即使川普的全球關稅政策最終被法院認定違法，與各國的貿易談判仍將持續。,https://m.cnyes.com/news/id/6087723
6087801,Fed理事庫格勒辭職 川普提前獲新人事機會,《CNBC》周五 (1 日) 報導，聯準會理事庫格勒 (Adriana Kugler) 宣布辭職，正好在川普力推降息的時候為 Fed 留下重要空缺。這位拜登任命的理事將回喬治城大學教書，讓川普有機會安插自己人進聯準會。,https://m.cnyes.com/news/id/6087801
6087778,川普出手了！下令派遣2艘核潛艦回敬俄國前總統威脅,綜合外媒周五 (1 日) 報導，美國總統川普下令 2 艘核潛艦移至戰略位置，以回應俄羅斯前總統 Dmitry Medvedev 的威脅言論。事件起因於川普本周給俄國 10 天烏克蘭停火最後通牒，Medvedev 隨後發表威脅性聲明。,https://m.cnyes.com/news/id/6087778
6087787,非農慘爆拖垮美股！川普怒炒勞工統計局局長,"美國總統川普周五 (8/1) 宣布，已指示團隊撤換勞工統計局 (Bureau of Labor Statistics, BLS) 局長 Erika McEntarfer，原因是當天公布的 7 月就業報告顯示新增非農就業僅 7.3 萬人，遠",https://m.cnyes.com/news/id/6087787
6087698,美就業成長創疫情來最慢 9月降息預期上調至9成,據《彭博》周五報導，美國 7 月非農就業報告遜於預期，過去 3 個月平均新增就業僅 3.5 萬人，創疫情以來最慢增速，失業率升至 4.2%。數據公布後，市場對 Fed 九月降息的預期從前一日的 40% 急升至近 90%，並質疑聯準會觀望策略。,https://m.cnyes.com/news/id/6087698
6087764,美商務部癱瘓？出口許可大塞車 輝達AI晶片受阻,《路透》周五 (8/1) 援引知情人士消息報導，美國商務部主管出口許可的產業與安全局 (BIS) 陷入運作混亂，導致數千件出口許可申請停滯不前，部分案件延宕時間創下 30 多年來最長紀錄，受影響的不僅包括對中國的人工智慧 (AI) 晶片,https://m.cnyes.com/news/id/6087764
6087739,任天堂Switch系列美國漲價 新款主機價格暫不動,根據《彭博》周五報導，任天堂同日宣布自 8 月 3 日起調漲美國 Switch 主機售價，聲稱是因應「市場狀況」。除了初代 Switch，OLED 版和 Lite 版也都漲價，部分 Switch 2 配件同步調漲，不過 Switch 2 主機不變。,https://m.cnyes.com/news/id/6087739
6087685,營收、獲利強勁、廣告業務成長23% 為何亞馬遜股價還大跌7%?,亞馬遜第二季財報多數指標超出預期，但華爾街仍不買單，股價周五重挫 7%。雲端事業成長不如微軟、Google 競爭對手亮眼，加上獲利指引疲弱，掩蓋了營收、獲利強勁、廣告業務成長 23% 的表現。,https://m.cnyes.com/news/id/6087685
6087686,iPhone爆賣救不了蘋果股價？投資人仍憂需求後繼乏力,根據《路透》報導，蘋果上季營收創下三年來最佳成長，但股價周五 (8/1) 在盤中下跌近 3%，因投資人質疑由關稅與補貼帶動的 iPhone 銷售能否持續。截稿前，蘋果 (AAPL-US) 盤中股價下跌 2.85%，每股暫報 201.65 美,https://m.cnyes.com/news/id/6087686
6087691,美7月密大消費信心升至5個月高點 通膨預期降溫,綜合外媒周五 (8/1) 報導，美國密西根大學 7 月消費者信心指數終值升至 61.7，創 5 個月新高，主要受股市上漲提振現況評估，但對未來景氣與通膨風險的疑慮仍壓抑整體信心。當月現況指數升至 68，為 6 個月高點，但預期指數下滑至 57,https://m.cnyes.com/news/id/6087691
6087608,就業數據疲軟聯準會降息預期急升 美債殖利率創一年最大跌幅,根據《彭博》周五 (1 日) 報導，美國 7 月就業數據疲軟讓債市大漲，短期公債殖利率創一年最大跌幅，交易員大舉押注聯準會最快 9 月降息。,https://m.cnyes.com/news/id/6087608
6087717,Fed傳聲筒：就業降溫+通膨未解！去年先觀望後大降息劇本將重現？,有「聯準會傳聲筒」之稱的《華爾街日報》(WSJ)記者 Nick Timiraos 周五 (8/1) 撰文指出，美國 7 月非農就業報告顯示勞動市場意外降溫，強化市場對聯準會 (Fed) 在 9 月降息的預期，但通膨壓力和政策不確定性，讓決策,https://m.cnyes.com/news/id/6087717
6087609,瑞士國慶日遭無預警重擊 川普課徵39%關稅創全球最高,根據《CNBC》周五 (1 日) 報導，瑞士在國慶日遭到川普政府課徵 39% 關稅重擊，成為全球稅率最高的國家之一。美國占瑞士出口約六分之一，這項決定讓原本期待能與歐盟、英國、日本等國獲得 10%-15% 基準稅率的瑞士大感震驚。,https://m.cnyes.com/news/id/6087609
6087690,連5個月萎縮！美7月ISM製造業指數僅48 寫9個月最慘紀錄,綜合外媒周五 (8/1) 報導，美國 7 月製造業活動持續萎縮，供應管理協會 (ISM) 製造業指數降至 48，創 9 個月來最大萎縮，低於市場預期的 49.5 並連續 5 個月低於 50 榮枯線。此外，隨著新關稅影響擴散，製造業就業指數跌至 43.4,https://m.cnyes.com/news/id/6087690
6087576,以太幣月漲54% 漲幅憑什麼打敗比特幣？,根據《商業內幕》周五 (1 日) 報導，比特幣今年雖然創下歷史新高，但最近的漲勢已被以太幣拋在腦後。以太幣過去一個月價格上漲 54%，相較之下比特幣僅上漲 10%。,https://m.cnyes.com/news/id/6087576
6087612,非農爆冷！川普再催鮑爾降息 Fed面臨政策轉向壓力,美國總統川普周五 (8/1) 在 7 月非農就業報告公布後再度發文施壓聯準會 (Fed) 主席鮑爾，要求立即降息。川普在社群平台上寫道：「太少、太晚。『慢郎中』鮑爾是一場災難。降息吧！好消息是，關稅正為美國帶來數十億美元收入！」,https://m.cnyes.com/news/id/6087612
6087668,鉅亨速報 - Factset 最新調查：亞馬遜AMZN-US的目標價調升至260元，幅度約3.38%,FactSet 最新調查：亞馬遜AMZN-US目標價調升，最高估值、最低估值、中位數、綜合評級、近5日股價、標普、即時新聞資訊,https://m.cnyes.com/news/id/6087668
6087418,〈美股早盤〉川普新關稅+非農爆冷 主要指數開低走低,美股主要指數周五 (8/1) 開低走弱，道瓊早盤重挫逾 500 點，投資人同時消化美國總統川普推出的新一輪關稅、亞馬遜疲弱財報，以及 7 月非農就業數據不如預期，這些因素加劇市場對經濟放緩的擔憂並推升聯準會 (Fed) 降息預期，美債殖,https://m.cnyes.com/news/id/6087418
6087600,林淑真：關稅、匯率雙重夾擊中小企業 台新銀放款強力支援,美國對台課徵 20% 對等關稅引起外界憂心，台新銀行總經理林淑真今 (1) 日表示，加徵關稅對中小企業的衝擊最為顯著，尤其是傳統產業，既未搭上 AI 熱潮，又要面對匯率劇烈波動，,https://m.cnyes.com/news/id/6087600
6087563,金融時報：台灣遭課20%關稅高於日韓 美中博弈下成夾心餅乾,根據《金融時報》周五 (1 日) 報導，台灣未能趕在川普 8 月 1 日截止期限前達成貿易協議，讓外界更加擔心美國可能為了改善美中關係而淡化對台灣的安全支持。,https://m.cnyes.com/news/id/6087563
6087586,德淵越南購地擴產 直接銷美比重低關稅風險相對有限,德淵越南購地擴產 直接銷美比重低關稅風險相對有限,https://m.cnyes.com/news/id/6087586
6087426,美日達成貿易協議後 日銀10月升息呼聲高,根據《彭博》周五 (8/1) 報導，在美國總統川普宣布包括與日本在內的多項貿易協議後，市場對日銀 (日本央行 / BOJ) 升息時點的預期提前。《彭博》調查顯示，42% 的經濟學家預期日銀將於 10 月升息，高於先前調查的 32%；預估 12,https://m.cnyes.com/news/id/6087426
6087559,聯準會31年來首度兩理事齊聲反對 憂降息腳步落後衝擊就業,美國聯準會本周維持利率不變決定遭兩名理事反對，華勒和鮑曼表示支持降息 1 碼，強調勞動市場疲軟跡象日益明顯，批評目前「觀望」政策過於謹慎，可能使政策落後於經濟情勢，對勞動市場造成不必要損害。,https://m.cnyes.com/news/id/6087559
6087419,遠遜預期！美7月非農就業僅新增7.3萬人 Fed 9月降息機率衝破7成,美國勞工統計局 (BLS) 周五 (8/1) 公布的 7 月非農就業報告遠遜預期，而且前兩個月數據遭大幅下修，讓三個月平均新增就業人數創下新冠疫情以來新低。不只如此，該月失業率小幅攀升也超乎預期。這份報告清楚顯示美國就業市場顯著降溫,https://m.cnyes.com/news/id/6087419
6087555,日本投資審查再延長 國巨公開收購芝浦電子期間同步延至8/18,日本投資審查再延長 國巨公開收購芝浦電子期間同步延至 8/18,https://m.cnyes.com/news/id/6087555
6087482,因應20%關稅衝擊！政院：一周內加碼編列「強化韌性特別預算」,行政院長卓榮泰於今（1）日召集相關部會首長與行政院臺美經貿工作小組，針對美方最新對我國公布 20% 的「暫時性稅率」，討論「因應美國關稅我國出口供應鏈支持方案」執行情形及特別預算的籌編，他特別針對原有 930 億支持方案，是否足,https://m.cnyes.com/news/id/6087482
6087425,川普再轟鮑爾 要求Fed理事會「接管控制權」,綜合外媒報導，美國總統川普周五 (8/1) 再度公開施壓聯準會 (Fed) 要求降息，並表示若主席鮑爾拒絕降息，Fed 理事會應「接管控制權」。,https://m.cnyes.com/news/id/6087425
